<?xml version="1.0" encoding="ISO-8859-1" ?>
<clientes xmlns:xsi="http://www.w3.org/2001/XMLSchema-instance" xmlns="http://www.clientes.es" xsi:schemaLocation="http://www.clientes.es clientes.xsd">
	<cliente idCliente="81422" dni="11111111" localidad="Madrid">
		<nombre>Antonio</nombre>
		<direcciones>
			<direccion>
				<ciudad>M�laga</ciudad>
				<calle>Larios</calle>
				<numero>5</numero>
			</direccion>
			<direccion>
				<ciudad>Madrid</ciudad>
				<calle>Alcal�</calle>
				<numero>120</numero>
			</direccion>
		</direcciones>
	</cliente>
	<cliente idCliente="81555333" dni="22222222" sexo="Hombre">
		<nombre>Jose Carlos</nombre>
		<apellido1>Martinez</apellido1>
	</cliente>
	<cliente idCliente="81888" dni="33333333" sexo="Mujer">
		<nombre>Josefa</nombre>
		<apellido1>Martin</apellido1>
		<apellido2>Fernandez</apellido2>
	</cliente>
</clientes>